News_Data,Labelling
"Sumber gambar, AFP via Getty Images Dewan Perwakilan Rakyat mengesahkan revisi undang-undang yang menetapkan Kementerian Badan Usaha Milik Negara menjadi badan pengaturan setingkat kementerian. Perubahan aturan soal BUMN merupakan yang kedua dalam tahun ini, setelah Februari lalu. Pengesahan revisi UU BUMN diketok Wakil Ketua DPR, Sufmi Dasco Ahmad, dalam rapat paripurna di gedung parlemen pada Kamis (02/10). Sebelum pengesahan, Ketua Komisi VI DPR, Anggia Ermarini, sempat menyampaikan laporan h",0
"Sumber gambar, BBC News Indonesia/Silvano Hajid Dua malam terkubur dalam tumpukan beton, Alfatih Cakra Buana, santri berusia 14 tahun, merangkak keluar reruntuhan dipandu tim SAR gabungan yang sudah dapat memastikan jalur evakuasi aman untuk anak itu. Terngiang-ngiang suara samar orang-orang dari luar menembus tebalnya reruntuhan, ""Sabar, sabar ya dik,"" kenang Alfatih. Saya balas, ""nggih pak, nggih. Begitu terus, sampai saya pingsan."" Namun, selama dua malam itu, yang Alfatih lihat hanyalah kege",0
"Sumber gambar, Naturalis Belanda akan mengembalikan 30.000 artefak ke Indonesia. Sebanyak 28.000 di antaranya merupakan bagian dari Pithecanthropus Erectus atau 'Manusia Jawa' yang kemudian disebut sebagai 'Koleksi Dubois'. Temuan penting di dunia paleontologi ini menyimpan sisi kelam eksploitasi kolonial. Pengembalian fosil-fosil yang ditemukan pada akhir abad ke-19 oleh EugÃ¨ne Dubois ini direkomendasikan Komite Koleksi Kolonial di Belanda yang menyimpulkan bahwa pemerintah Belanda tidak pernah",1
"Sumber gambar, ANTARA FOTO/Aprillio Akbar/YU Tiga terdakwa kasus pengancaman dan pemerasan di lingkungan Program Pendidikan Dokter Spesialis (PPDS) Anestesi Universitas Diponegoro, Semarang, divonis lebih rendah dari tuntutan jaksa. Ini merupakan putusan pertama kasus pemerasan di dunia pendidikan kedokteran spesialis di Indonesia. Terdakwa pertama atas nama Zara Yupita Azra, mahasiswa senior PPDS Anestesi Undip dijatuhi hukuman sembilan bulan penjara. Dalam putusannya, Hakim Ketua Djohan, menga",-1
"Sumber gambar, Elgo Kematian Erenius Yirani Bawa Taipot yang diduga ditembak anggota Satgas Yonif 123/Rajawali menyulut amarah massa di Agats, Kabupaten Asmat, Papua Selatan. Tangis keluarga korban seketika pecah begitu melihat tubuh pemuda 21 tahun itu terkapar di pinggir jalan. Tak beberapa lama, massa berdatangan dan memicu aksi pembakaran pos satgas, hingga penjarahan sejumlah toko. Pihak keluarga Erenius pun menuntut sejumlah hal, satu di antaranya ""memulangkan"" pasukan tentara non-organik",-1
"""Bagaimana keadaan keponakan saya? Apa bisa diselamatkan atau tidak?"" kata Holy Abdullah Arief, paman korban. Rozi, keponakan Holy, termasuk salah satu korban yang diduga masih terjebak di reruntuhan Ponpes Al Khoziny di Sidoarjo. Data BNPB pada Selasa (30/09) malam menyebut, puluhan santri diduga masih tertimbun reruntuhan. Â© 2025 BBC. BBC tidak bertanggung jawab atas konten dari situs eksternal. Baca tentang peraturan baru terkait link eksternal.",0
"Sumber gambar, DimaBerkut/Getty Images Di balik julukan ""destinasi wisata unggulan"", Bali menyimpan sisi kelam. Orang-orang Bali disebut ""tertawan"" pariwisata karena tidak ada sektor lain yang dinilai lebih menguntungkan. Kebanyakan warga Bali disebut takut bersuara karena sudah 'dikondisikan' untuk tidak memprotes perkembangan pariwisata. Mengapa dan sejak kapan ini bermula? Gelombang demonstrasi yang memprotes kinerja anggota dewan dan tindakan represif polisi pada akhir Agustus lalu terjadi d",-1
"Sumber gambar, Getty Images Presiden AS Donald Trump dan Perdana Menteri Israel Benjamin Netanyahu telah menyepakati rencana perdamaian baru untuk Gaza. Pemerintah Indonesia menyambut baik kesepakatan tersebut. Namun, seorang pengamat menilai pemerintah Indonesia sepatutnya mengkaji dulu butir-butir kesepakatan dan ""tidak menyerahkan cek kosong"" begitu saja pada Trump. Rencana perdamaian yang digulirkan Trump itu mengusulkan agar operasi militer Israel di Gaza harus dihentikan segera.  Di sisi l",0
"Sumber gambar, ANTARA FOTO Kasus keracunan yang menimpa lebih dari 7.000 anak akibat program Makan Bergizi Gratis (MBG) menimbulkan sorotan pada peran pelaksana di lapangan, Satuan Pemenuhan Pelayanan Gizi (SPPG).  Kontribusi SPPG dalam MBG berkaitan erat dengan penyediaan serta distribusi menu makanan kepada para siswa. BGN memasang target terciptanya 31.000 SPPG di seluruh Indonesia sampai akhir 2025 untuk mencapai 82 juta orang penerima manfaat MBG. Namun, pembentukan SPPG tidak luput dari pe",-1
"Pesantren Al-Khoziny di Sidoarjo, Jawa Timur roboh saat ratusan santri berkumpul untuk salat Ashar pada Senin (29/09). Tiga korban meninggal dunia hingga Selasa siang.  Sebanyak 102 orang telah dievakuasi dan 38 orang diduga masih terjebak di reruntuhan. Â© 2025 BBC. BBC tidak bertanggung jawab atas konten dari situs eksternal. Baca tentang peraturan baru terkait link eksternal.",-1
"Tragedi 1965 di Padang Halaban, Sumatra Utara, menjadi bukti bagaimana negara melalui militer menggunakan propaganda ""kejahatan komunis"" untuk menangkap dan membunuh warga yang dicurigai sebagai ""orang-orang Kiri"" tanpa proses hukum, serta merampas lahan pertanian yang sebelumnya digarap oleh masyarakat. Poniyem tidak sabar menanti kelahiran anak ketiganya yang, menurut perhitungan, jatuh pada Oktober 1965. Dia bersama suami, Sabarudin, sangat antusias sebab ini kali pertama mereka akan punya an",-1
"Sumber gambar, ANTARA FOTO Mahkamah Konstitusi mengabulkan seluruh permohonan pengujian UU Nomor 4 Tahun 2016 tentang Tabungan Perumahan Rakyat (Tapera) yang diajukan oleh Konferedasi Serikat Buruh Seluruh Indonesia (KSBSI). Dalam amar putusannya, Mahkamah menyatakan UU Tapera inkonstitusional lantaran Pasal 7 ayat 1 yang disebut sebagai ""pasal jantung"" dalam beleid itu telah bertentangan dengan UUD 1945. Pasal 7 ayat 1 berbunyi: ""Setiap pekerja dan pekerja mandiri yang berpenghasilan paling sed",0
"Sumber gambar, BBC/Getty Images Peristiwa kekerasan 1965 yang menargetkan kelompok komunis dan yang terafiliasi dengannya kini genap 60 tahun. Tragedi yang merenggut banyak hal, termasuk kepemilikan tanah, masih meninggalkan trauma mendalam bagi para penyintas. Wahid baru berusia tujuh tahun ketika Peristiwa 1965 meletus. Kala itu, dia dan keluarganya menempati satu rumah petak di kawasan Perkebunan Panigoran, Sumatra Utara. Dia mengingat masa kecilnya dengan begitu hangat. Meski pendapatan oran",0
"Sumber gambar, ANTARA FOTO/Novrian Arbi Ribuan kasus keracunan akibat MBG ditemukan di sejumlah daerah di Indonesia. Merespons kasus keracunan MBG, pemerintah bilang evaluasi Satuan Pelayanan Pemenuhan Gizi (SPPG) dan standar higienis jadi prioritas. Menteri Koordinator bidang Pangan, Zulkifli Hasan, bilang SPPG bermasalah ditutup sementara untuk dilakukan evaluasi dan investigasi.  Salah satu evaluasi yang utama adalah soal kedisiplinan dan kualitas makanan di seluruh SPPG, serta sterilisasi se",-1
"Sumber gambar, Getty Images Bali, surga tropis Indonesia yang tersohor, telah memikat banyak wisatawan selama bertahun-tahun.  Namun, pulau ini juga meninggalkan semakin banyak pengunjung dengan perasaan kecewaâ€”salah satunya adalah Zoe Rae baru-baru ini. ""Sejak mendarat di Bali, ada sesuatu yang terasa tidak beres bagi kami,"" ujarnya dalam video YouTube pada Juli silam, yang direkam di kamar hotelnya. ""Kami datang ke Bali dengan ekspektasi tinggi karena kami melihat di media sosial semua orang b",0
"Sumber gambar, ANTARA FOTO/Ardiansyah Rancangan Undang-Undang (RUU) Perampasan Aset resmi masuk dalam program legislasi nasional (prolegnas) prioritas 2025-2026 setelah disahkan DPR melalui Rapat Paripurna. Artinya, ada upaya mengubah RUU menjadi UU. Namun, meski semangat aturan ini adalah untuk pemberantasan korupsi serta pengembalian aset ke negara, terdapat kekhawatiran pada pelaksanaannya. Kecemasan mengenai RUU Perampasan Aset ialah peluang beleid ini dipakai sebagai alat gebuk politik kepa",-1
"Pemerintah sudah menyalurkan dana Rp200 triliun ke bank-bank negara untuk menggerakkan ekonomi dan menciptakan lapangan kerja. Menteri Keuangan Purbaya Yudhi Sadewa bilang, dana itu bisa disalurkan dalam bentuk kredit kepada masyarakat.  Masalahnya, bank-bank tengah kesulitan mencari pihak yang ingin mengajukan kredit karena daya beli masyarakat sedang lesu. Lalu, bagaimana cara agar guyuran uang itu bisa benar-benar berdampak ke ekonomi masyarakat sampai ke level bawah? Simak penjelasannya. Vid",1
"Sumber gambar, ANTARA FOTO DPR RI resmi mengesahkan Rancangan Undang-Undang (RUU) Anggaran Pendapatan dan Belanja Negara (APBN) 2026 menjadi undang-undang, pada Selasa (23/09). Pengamat mengingatkan agar rem penggunaan anggaran tetap harus dijaga dan tidak melupakan pentingnya peningkatan penerimaan negara. Ada sejumlah perubahan pada beberapa pos anggaran yang berdampak kenaikan nominal APBN 2026 daripada nota keuangan RAPBN pada Agustus lalu.  Semula, belanja negara mengacu pada RAPBN 2026 seb",0
"Sumber gambar, KOMPAS.com/BAGUS PUJI PANUNTUN Program Makan Bergizi Gratis (MBG) andalan pemerintahan Prabowo Subianto-Gibran Rakabuming dikritik keras lantaran menimbulkan lebih dari 5.000 kasus keracunan di puluhan kota dan kabupaten di 16 provinsi. Kerugian dari peristiwa ini terlihat jelas. Apakah korban keracunan dapat menggugat pemerintah secara hukum? Beberapa murid SMA yang BBC News Indonesia temui merasakan pusing, mual, dan sakit perut selepas mengonsumsi menu MBG. Mereka meminta pengu",-1
"Sumber gambar, Getty Images/Irfan Setiawan Presiden Prabowo Subianto akhirnya mengeluarkan keputusan terkait kelanjutan proyek Ibu Kota Nusantara (IKN) di Penajam Paser Utara, Kalimantan Timur, yang digagas pendahulunya, Joko Widodo. Melalui Peraturan Presiden (Perpres) Nomor 79 Tahun 2025 tentang Pemutakhiran Rencana Kerja Pemerintah Tahun 2025 disebutkan bahwa ""perencanaan dan pembangunan kawasan, serta pemindahan ke Ibu Kota Nusantara dilaksanakan sebagai upaya mendukung terwujudnya Ibu Kota",0
"Sumber gambar, Detik.com/Dokumen Freeport Dua karyawan PT Freeport Indonesia yang terjebak sejak Senin (08/09) lalu di area tambang bawah tanah di Tembagapura, Mimika, Papua Tengah, ditemukan meninggal dunia. Kepolisian dilaporkan sudah mengidentifikasi dua korban tersebut. Sementara, lima orang karyawan lainnyaâ€”yang belum ditemukanâ€”masih terus dicari, kata Freeport. Dalam keterangan tertulis PT Freeport Indonesia yang diterima BBC News Indonesia, Sabtu (20/09), dua jenazah ditemukan sekitar puk",-1
"Sumber gambar, ANTARA FOTO/Fauzan Warga Kabupaten Pati, Jawa Tengah, kembali melakukan aksi unjuk rasa menuntut Bupati Pati, Sudewo, mengundurkan diri karena dianggap ""arogan"" dan diduga melakukan korupsi.  Ratusan warga yang tergabung dalam Aliansi Masyarakat Pati Bersatu berunjuk rasa di depan Gedung DPRD Pati, Jumat (19/09) siang.  Selain menuntut pengunduran diri Bupati Pati, Sudewo, massa juga meminta partai politik mengawal tuntas proses Panitia Khusus (Pansus) Hak Angket Pemakzulan Bupati",0
"Sumber gambar, Arie Firdaus Pemerintah DKI Jakarta berencana melarang penggunaan ondel-ondel untuk mengamen di jalanan. Pelarangan dimaksudkan Gubernur Pramono Anung demi menjaga muruah salah satu kesenian Betawi tersebut. Namun, rencana ini menyelipkan masalah lain: menambah potensi pengangguran di Jakarta. Pengamen ondel-ondel mengaku tak memiliki pekerjaan lain dan khawatir bakal kehilangan pendapatan jika pemerintah daerah betul-betul merealisasikan pelarangan itu. ""Kalau ondel-ondel dilaran",-1
"Upaya masyarakat sipil menolak UU TNI di pengadilan belum membuahkan hasil. Mahkamah Konstitusi menolak permohonan uji formil terkait Undang-undang Nomor 3 Tahun 2025 tentang TNI, Rabu (17/09). Selain persoalan kedudukan hukum, MK menyatakan pembahasan perubahan UU TNI sudah sesuai dengan aturan dan tidak melanggar hak konstitusional. Putusan kali ini dikhawatirkan berdampak pada demokrasi ke depan, kata ahli hukum. Video produksi: Tri Wahyuni dan Andra Anhar Â© 2025 BBC. BBC tidak bertanggung ja",0
"Sumber gambar, ANTARA FOTO Presiden Prabowo Subianto menambah panjang daftar sosok eks-perwira militer era Orde Baru yang direkrut ke dalam pemerintahan. Terbaru, Prabowo melantik purnawirawan TNI, Djamari Chaniago, sebagai Menteri Koordinator Bidang Politik dan Keamanan (Menko Polkam) menggantikan Budi Gunawan, pada Rabu (18/09). Pengamat menilai Prabowo hendak melingkupi dirinya dengan orang-orang yang punya ""bahasa yang sama"" agar beragam programnya dapat berjalan mulus. ""Kebanyakan orang yan",0
"Sumber gambar, Dok. KNPB Yalimo Kerusuhan pecah di Kabupaten Yalimo, Pegunungan Tengah, Selasa (16/09) diduga dipicu ucapan rasis terhadap orang asli Papua. Agar tidak berulang, tokoh agama di Papua mendorong konflik ini diselesaikan dengan ""rekonsiliasi"" bukan pendekatan keamanan. Kepolisian Papua melaporkan lebih dari 30 kios dan rumah dibakar massa di Elelim, Kabupaten Yalimo. Selain itu, enam rumah dinas dan satu mes perwira turut dibakar. ""Satu bangunan SMA rusak dan 13 unit sepeda motor ik",-1
"Sumber gambar, Antara Foto Seorang polisi yang menembak sesama anggota polisi hingga tewas di Solok Selatan, Sumatra Barat, dijatuhi hukuman penjara seumur hidup oleh majelis hakim Pengadilan Negeri Padang, pada Rabu (17/09). Vonis terhadap Dadang Iskandarâ€”yang saat kejadian masih berstatus sebagai polisi berpangkat AKPâ€”dibacakan Ketua Majelis Hakim, Aditya Danur Utomo. ""Mengadili, saudara yang telah melakukan pembunuhan berencana atau mencoba melakukan pembunuhan berencana sesuai dakwaan kesatu",0
"Sumber gambar, Ryan Suherlan/NurPhoto melalui Getty Images Mahkamah Konstitusi menolak permohonan uji formil terkait Undang-undang Nomor 3 Tahun 2025 tentang TNI. Selain persoalan kedudukan hukum, MK menyatakan pembahasan perubahan UU TNI sudah sesuai dengan aturan dan tidak melanggar hak konstitusional. Putusan kali ini dikhawatirkan berdampak pada demokrasi ke depan, kata ahli hukum. ""Mahkamah berpendapat, telah ternyata proses pembentukan UU 3/2025 secara formil tidak bertentangan dengan UUD",0
"Sumber gambar, ANTARA FOTO Presiden Prabowo Subianto telah melantik Djamari Chaniago sebagai Menko Polkam yang baru. Adapun Eric Thohir resmi dilantik sebagai Menteri Pemuda dan Olahraga. Posisi Menko Polkam sebelumnya dijabat sementara oleh Menteri Pertahanan Sjafrie Sjamsoeddin, setelah Budi Gunawan diganti. Sementara Erick Thohir mengisi posisi Menteri Pemuda dan Olahraga yang baru. Dia menggantikan Dito Ariotedjo, yang telah dicopot dari posisinya. Erick Thohir sebelumnya menjabat sebagai Me",0
"Insiden kandasnya kapal pesiar Caledonian Sky pada 2017 silam, telah merusak salah satu ekosistem laut dengan keanekaragaman hayati tertinggi di dunia. Kapal pesiar yang membawa wisatawan berlayar ke perairan Raja Ampat yang dilindungi, kandas saat air surut, menghancurkan spesies karang langka dan memorak-porandakan kehidupan laut. Diperkirakan ribuan kilometer persegi terumbu karang di Pulau Kri dan sekitarnya rusak, menyebabkan warga yang menggantungkan hidup mereka pada laut, terdampak. Kini",-1
"Sumber gambar, AFP via Getty Images Video Presiden Prabowo yang muncul sebelum penayangan film di bioskop dinilai mirip dengan konsep newsreel â€” film beritaâ€” yang terkadang dipakai sebagai propaganda pemerintah ketika mengalami krisis.  Di sisi lain, video tersebut juga dianggap mengganggu privasi publik walau tidak melanggar aturan, kata pengamat. Banyak warga yang bersuara di media sosial usai mendapati video itu ketika hendak menyaksikan film di bioskop.  Mereka mempertanyakan tujuan dan maks",0
"Sumber gambar, Dimas Ardian/Bloomberg via Getty Images Stok bahan bakar minyak di SPBU swasta minim sejak akhir Agustus lalu. Pemicunya beragam, dari dinamika pasar hingga dampak kebijakan pemerintah. Namun, satu pertanyaan masih terus diperbincangkan: apakah ada praktik monopoli yang menyebabkan kondisi ini? Di sebuah SPBU Shell di Jakarta Selatan, seorang pegawai menginformasikan stok BBM yang tersedia hanya yang berkadar RON 92. Sisanya kosong. ""Dari pusat sudah begini sejak beberapa hari ter",-1
"Sumber gambar, ANTARA FOTO/Muhammad Adimaja Pemerintah Indonesia meluncurkan 17 program paket stimulus ekonomi yang dinamakan ""Paket Stimulus Ekonomi 8+4+5"" dengan total stimulus mencapai Rp16,23 triliun. Melalui stimulus paket ekonomi ini, pemerintah mengejar target pertumbuhan ekonomi sebesar 5,2 persen pada akhir 2025. Program ini mencakup delapan inisiatif utama, empat program yang diperpanjang ke 2026, serta lima program khusus untuk penyerapan tenaga kerja. Salah satu stimulus dalam delapa",1
"Sumber gambar, ANTARA FOTO/Muhammad Iqbal Pihak berwenang Peru menangkap lima orang yang diduga terkait penembakan yang menewaskan staf Kedutaan Besar Republik Indonesia (KBRI) di Lima, Zetro Leonardo Purba pada awal September silam, lapor kantor berita Andina. Kepolisian Nasional Peru (PNP) mengungkap lima orang ini adalah anggota geng yang dikenal sebagai Los Maleantes del Cono. Mereka ditangkap dalam operasi di distrik San MartÃ­n de Porres, Lima, 10 September lalu. Zetro meninggal dunia setel",0
"Sumber gambar, Antara Foto Presiden Prabowo Subianto berencana membagikan 330 ribu televisi pintar (smart TV) bagi sekolah di semua jenjang pendidikan untuk mendukung proses belajar mengajar. Pengamat menilai rencana itu menunjukkan bahwa pemerintah gagal memahami masalah mendasar dalam dunia pendidikan di Indonesia. Proyek ini dikhawatirkan akan membuka celah korupsi, seperti pengadaan laptop yang kini menjerat eks menteri Nadiem Makarim. Proyek laptop pada era Nadiem memimpin Kementerian Pendi",0
"Bendera One Piece dikibarkan oleh para pengunjuk rasa di Nepal dan Prancis. Adakah hubungannya dengan bendera One Piece yang dikibarkan di Indonesia? Sosiolog Okky Madasari berkata banyak pengalaman hidup yang dialami anak muda saat ini: tekanan ekonomi, sensor digital, birokrasi yang absurd, hingga pelecehan kekuasaan. Menurutnya, budaya pop menjadi jembatan antara kemarahan mereka dengan bentuk ekspresi yang bisa dipahami semua orang. Cerita One Piece dengan tokoh sentral, Monkey D. Luffy dan",0
"Sumber gambar, IMDB Tayangan drama berupa perselingkuhan dan ketidaksetiaan terhadap pasangan kembali menjadi tontonan publik. Film Norma: Antara Mertua dan Menantu menanjak popularitasnya di Indonesia, Malaysia, dan Singapura setelah masuk ke pelantar digital Netflix. Bahkan kini, warga di Myanmar juga ramai menyaksikan film ini. Nukilan kisah hidup perempuan bernama Norma Risma yang dikhianati oleh suaminya ini diketahui masyarakat setelah curhatnya viral melalui Tiktok pada akhir 2022.  Ia me",0
"Sumber gambar, Kepolisian Federal Australia Kepolisian Australia menangkap dan mendakwa dua pria asal Australia yang diduga memasok senjata api dan peralatan militer dari Australia ke Tentara Pembebasan Nasional Papua Barat-Organisasi Papua Merdeka (TPNPB-OPM), kelompok di balik peristiwa penculikan pilot Selandia Baru bernama Phillip Mehrtens. Mehrtens disandera pada Februari 2023 setelah mendaratkan pesawat kecil di Bandara Paro, Papua Barat. Dia ditawan selama 592 hari, lalu dibebaskan pada S",0
"Sumber gambar, PPI Belanda Seorang mahasiswa Indonesia yang studi di Belanda meninggal dunia akibat kelelahan, diduga karena menemani pejabat yang sedang melakukan kunjungan ke Austria. Kini muncul tekanan publik agar kematiannya diusut tuntas, termasuk siapa yang semestinya bertanggung jawab. Informasi perihal kematian Athaya Helmi Nasution, mahasiswa Indonesia yang melanjutkan studi ke Belanda, pertama kali disampaikan Perhimpunan Pelajar Indonesia (PPI) Belanda, Senin (08/09). Dalam siaran re",-1
"Sumber gambar, ANTARA/HO-Direktorat Reserse Kriminal Umum Polda Metro Jaya. Seorang anggota TNI Angkatan Darat dengan pangkat kopral dua, berinisial FH, ditetapkan menjadi tersangka dalam kasus pembunuhan kepala cabang BRI. Komandan Polisi Militer di Kodam Jaya, Kolonel Donny Prianto, menyebut pihaknya telah menahan tentara tersebut. ""Saat kejadian tersebut, [pelaku] sedang dicari oleh satuan karena tidak hadir tanpa izin dinas,"" kata Kolonel Donny kepada wartawan Kompas.com. Merujuk laporan Tem",0
"Sumber gambar, ANTARA FOTO/Dhemas Reviyanto Kebijakan menggelontorkan dana pemerintah sebesar Rp200 triliun ke bank-bank komersial diragukan sejumlah ekonom bisa mengerek perekonomian nasional. Persoalannya bukan banyaknya ketersediaan uang di bank, tapi lesunya minat para peminjam karena daya beli masyarakat yang diyakini lesu. Presiden Prabowo Subianto memberi lampu hijau kepada Menteri Keuangan Purbaya Yudhi Sadewa untuk menyuntik kas negara ke bank-bank komersial. Angkanya Rp200 triliun dari",0
"Sumber gambar, Dok. Kementerian ESDM Pemerintah Indonesia melalui Kementerian Energi dan Sumber Daya Mineral (ESDM) telah mengizinkan PT GAG Nikel untuk beroperasi kembali di Raja Ampat, Papua Barat Daya, sejak Rabu (03/09). Langkah ini dikritik pegiat lingkungan yang menyebutnya sebagai ""kabar buruk"" bagi upaya ""menyelamatkan RajaAmpat dari bahaya tambang nikel"".  Greenpeace Indonesia menilai keputusan ini merupakan pengabaian langsung terhadap ekosistem laut Raja Ampat yang menjadi rumah dari",-1
"Sumber gambar, DICKY BISINGLASI/AFP via Getty Images Korban meninggal dunia akibat banjir di sejumlah daerah di Bali, bertambah dari 14 orang menjadi 16 orang, kata Badan Nasional Penanggulangan Bencana (BNPB).  Adapun satu orang dilaporkan masih dinyatakan hilang sampai Jumat (12/09) siang. Di Kota Denpasar dilaporkan 10 orang meninggal dunia, dua orang di Kabupaten Jembrana, dan tiga orang di Kabupaten Gianyar, serta satu orang di Kabupaten Badung, kata BNPB. Dan, ""satu masih dilaporkan hilang",-1
"Sumber gambar, Anadolu via Getty Images Aksi di sejumlah negara â€”Indonesia, Nepal, dan Prancisâ€” belakangan ini identik dengan para anak muda yang menyematkan ikon One Piece ketika turun ke jalan. Dari bendera Jolly Roger hingga topi jeraminya terlihat di tengah massa aksi. Ada apa dengan dunia hingga para nakama bergerak? Sosiolog Okky Madasari berkata banyak pengalaman hidup yang dialami anak muda saat ini: tekanan ekonomi, sensor digital, birokrasi yang absurd, hingga pelecehan kekuasaan. ""Bud",0
"Sumber gambar, Abd Rahman Muchtar Tujuh tahun setelah insiden kapal pesiar Caledonian Sky yang menghancurkan terumbu karang di Raja Ampat, proyek pemulihan dengan melibatkan perempuan masyarakat adat setempat telah dimulai.  Para perempuan adat Yenbuba di Raja Ampat, Papua Barat Daya, dilibatkan secara langsung dalam restorasi terumbu karang, bekerja sama dengan para ilmuwan dan menggunakan teknologi transplantasi karang untuk memulihkan ekosistem laut yang rusak.  Keterlibatan perempuan adat in",0
"Sumber gambar, Front Justice For Tobias Silak Kematian laki-laki muda asli Papua bernama Viktor Bernadus Deyal, 3 September lalu, memicu kemarahan warga Distrik Dekai, Kabupaten Yahukimo, Papua Pegunungan. Sejumlah polisi diduga menganiaya Viktor hingga tewas tanpa alasan hukum. Satu hari setelah kematiannya, pihak keluarga bersama ratusan warga membopong jenazah Viktor dengan berjalan kaki ke kantor Polres Yahukimo. Mereka menuntut keadilan: hukuman pidana untuk para polisi yang menghilangkan n",-1
"Sumber gambar, NurPhoto via Getty Images Kendati DPR telah memutuskan untuk menghentikan tunjangan perumahan Rp50 juta per bulan untuk semua legislator mulai 31 Agustus 2025, keputusan itu tidak serta merta diikuti oleh DPRD di berbagai daerah di Indonesia.  Di Jakarta, tunjangan rumah anggota DPRD Jakarta mencapai Rp70 juta per bulan.  Selain DPRD Jakarta, DPRD yang nominal tunjangan rumahnya cukup besar adalah Jawa Tengah, Jawa Barat, Jawa Timur, dan Sumatra Utara. Merespons temuan itu, pimpin",0
"Sumber gambar, Balai TNTN Seekor anak gajah sumatera bernama Kalistha Lestari, atau dikenal dengan nama Tari, dilaporkan mati di Balai Taman Nasional Tesso Nilo (TNTN), Riau, Rabu (10/09). Selain Tari, sepanjang 10 tahun terakhir, tercatat ada 23 kasus kematian gajah sumatera di taman nasional tersebut. Penyebabnya mulai dari diracun, perburuan liar, penyakit, hingga menyempitnya habitat mereka. Kepala Balai TNTN, Heru Sutmantoro, membuat klaim gajah berusia dua tahun 10 hari itu tidak menunjukk",-1
"Sumber gambar, ANTARA FOTO/Dhemas Reviyanto Menteri Keuangan, Purbaya Yudhi Sadewa, mengatakan bakal mendorong pertumbuhan ekonomi 6%-7% agar ketidakpuasan publik tidak meledak seperti yang terjadi dalam gelombang demonstrasi di sejumlah daerah baru-baru ini. Tapi sejumlah ekonom sangsi cara itu akan menyelesaikan akar masalah, yaitu soal ketidakadilan anggaran negara. Lantas, apa saja pekerjaan rumah Menteri Purbaya? Presiden Prabowo Subianto telah resmi melantik Purbaya Yudhi Sadewa sebagai me",0
"Sumber gambar, Koalisi KOPI Rudolfus Oktavianus Ruma, seorang aktivis lingkungan di Nusa Tenggara Timur, ditemukan meninggal dunia dengan leher terjerat di sebuah pondok bambu dekat Pantai Sikusama, Kecamatan Nangaroro, Kabupaten Nagekeo, pada 5 September lalu. Keluarga meminta kepolisian mengusut tuntas dan transparan soal kematian Oktavianus yang akrab disapa Vian. Mereka menyebut kasus kematian Vian dipenuhi kejanggalan. ""Kami berharap ada transparansi [pengungkapan], agar kakak bisa pergi de",-1
"Sumber gambar, YULI SAPUTRA Impitan ekonomi diduga menjadi pemicu utama di balik keputusan seorang ibu di Kabupaten Bandung, Jawa Barat, mengakhiri hidupnya dan dua anaknya. Para pengamat menilai ini adalah bukti kegagalan negara dalam menjamin kehidupan yang layak bagi masyarakat kelas bawah. EN, perempuan 34 tahun, ditemukan tewas gantung diri di kusen pintu kamarnya. Dua anaknya yang berusia 9 tahun dan 11 bulan ditemukan tak bernyawa tak jauh dari sang ibu.  Kesimpulan sementara polisi kemat",-1
