News_Data,Labelling
"Istilah ekonomi yang serakah atau 'serakahnomics' kembali digaungkan Presiden RI Prabowo Subianto. Kali ini, di forum APEC (APEC Economic Leaders' Meeting/AELM) di Gyeongju, Korea Selatan, Prabowo mewanti-wanti ekonomi yang serakah menjadi penghambat utama pertumbuhan ekonomi. Prabowo menyampaikan hal itu dalam pidatonya pada Pertemuan Para Pemimpin Ekonomi APEC di Gyeongju, Korea Selatan, Jumat (31/10) waktu setempat. Dalam forum yang dihadiri para kepala negara dan pemerintahan dari 21 ekonomi",0
"Wakil Ketua MPR RI Lestari Moerdijat (Rerie) mendorong pemberdayaan perempuan lewat peningkatan keterampilan di sektor pertanian sebagai langkah strategis untuk mewujudkan ketahanan pangan berkelanjutan. ""Masalah yang kita hadapi ke depan adalah ketahanan pangan. Bagaimana kita dapat beraktivitas agar mampu memenuhi kebutuhan pangan mulai lingkup terkecil seperti keluarga, merupakan langkah yang penting,"" kata Rerie dalam keterangannya, Minggu (2/11/2025). Hal tersebut disampaikannya secara dari",1
"Fraksi Gerindra DPR akan mengaktifkan lagi Rahayu Saraswati Djojohadikusumo sebagai anggota DPR. Sara--sapaan Rahayu--akan aktif lagi setelah partai menerima salinan putusan dari Mahkamah Kehormatan Dewan (MKD) DPR RI. ""Secepatnya setelah fraksi menerima salinan putusan MKD agar tidak terjadi kekosongan 1 Anggota fraksi Gerindra di Komisi VII,"" kata Sekretaris Fraksi Gerindra DPR Bambang Haryadi saat dihubungi, Minggu (2/11/2025). Pimpinan Komisi XII DPR itu mengatakan partai juga berkomunikasi",0
"Batik di sejumlah kota seperti Solo, Yogyakarta, Cirebon, dan Pekalongan sudah menjadi hal yang                lumrah. Daerah-daerah itu memang dikenal sebagai pusat industri batik di tanah air. Namun kini,                hampir di setiap daerah di Indonesia dari Sabang hingga Merauke, muncul semangat untuk menonjolkan                batik khas daerahnya masing-masing â€” termasuk Kota Depok di Jawa Barat.                             Depok mungkin lebih dikenal sebagai kota penyang",0
"Sebidang lahan di kawasan Hutan Produksi (HP), Kecamatan Balai Jaya, Kabupaten Rokan Hilir (Rohil), Provinsi Riau, terbakar gara-gara puntung rokok. Pemilik lahan, MT alias Rio (53) diamankan dan ditetapkan sebagai tersangka. Kapolres Rohil AKBP Isa Imam Syahroni menyampaikan penindakan ini merupakan komitmen Polres Rohil dalam penegakan hukum terhadap para pelaku perusakan hutan dan lahan. ""Penindakan ini membuktikan bahwa kami serius menindak kejahatan lingkungan. Meskipun penyebabnya dari pun",0
"Artis Onadio Leonardo atau yang akrab disapa Onad ditangkap terkait kasus narkoba. Ia ditangkap bersama istrinya, Beby Prisillia. Mereka ditangkap di rumahnya di kawasan Rempoa, Tangerang Selatan, pada Kamis (30/10) malam. ""Benar, (istri Onad) ikut diamankan juga,"" kata Kabid Humas Polda Metro Jaya Brigjen Ade Ary Syam Indradi membenarkan Onad ditangkap bareng istri, kepada wartawan, Jumat (31/10).  SCROLL TO CONTINUE WITH CONTENT   Artis Onadio Leonardo atau Onad menjalani tes urine narkoba s",0
"Satuan Tugas (Satgas) Penanganan Cesium-137 masih terus melakukan dekontaminasi di kawasan Industri Modern Cikande, Kabupaten Serang, Banten yang terpapar radiasi. Proses dekontaminasi ditargetkan rampung pada pekan depan. ""Proses dekontaminasi 13 lapak masih berlangsung secara intensif, kira-kira sudah 80 persen rampung. Diharapkan minggu depan seluruhnya bisa selesai,"" kata Ketua Bidang Diplomasi dan Komunikasi Satgas Penanganan Bahaya Radiasi Radionuklida Cs-137, Bara Krishna Hasibuan, saat d",0
"Kecelakaan terjadi di Tanjakan Cae, Kecamatan Wado, Kabupaten Sumedang, Jawa Barat, pada Senin (1/11) malam. Dilaporkan 19 orang menjadi korban dari insiden tersebut, 3 di antaranya meninggal dunia. Saat ini para korban telah dibawa ke RSUD Umar Wirahadikusumah Sumedang. Mayoritas korban mengalami luka parah.",-1
"Tanggul Baswedan di Jati Padang, Pasar Minggu, Jakarta Selatan, jebol hingga menyebabkan air meluap atau banjir ke rumah warga. Petugas Dinas Sumber Daya Air (SDA) sudah berupaya menambal tanggul tersebut dengan karung pasir, tapi air tetap menerobos. Berdasarkan catatan detikcom, Minggu (2/11/2025), tanggul Baswedan jebol pada Kamis (30/10) malam. Tanggul itu tak kuasa menahan luapan air di Kali PHB.   SCROLL TO CONTINUE WITH CONTENT  Imbasnya, Kelurahan Jati Padang pun terendam luapan air. D",-1
"Polisi masih memeriksa artis Onadio LeonardoOnadio Leonardo atau yang akrab disapa Onad setelah ditangkap terkait kasus otomotif narkotika. Onad mengaku menyesal terlibat kasus narkoba.Onad setelah ditangkap terkait kasus penyalahgunaan narkotika. Onad mengaku menyesal terjerat kasus narkoba. ""Menyesal, pasti ada penyesalan,"" kata Kasie Humas Polres Metro Jakarta Barat AKP Wisnu saat dihubungi, Minggu (2/11/2025).Kasie Humas Polres Metro Jakarta Barat AKP Wisnu saat dihubungi, Minggu (2/11/2025)",-1
"Presiden ke-7 RI Joko Widodo (Jokowi) tak dapat menghadiri langsung Kongres III Projo. Meski begitu, Jokowi tetap menyampaikan pesannya kepada para relawan melalui video. Kongres III Projo digelar di Hotel Grand Sahid, Jakarta Selatan, Sabtu (1/11/2025). Ajudan Jokowi, Kompol Syarif Muhammad Fitriansyah, menjelaskan bahwa Jokowi diminta beristirahat oleh tim dokter sehingga tak dapat hadir di Kongres Projo. ""Karena pertimbangan tim dokter yang menganjurkan Bapak (Jokowi) untuk beristirahat dan t",0
"Pemerintah lewat Kemenhaj resmi melegalkan umrah mandiri lewat Undang-Undang Nomor 14 Tahun 2025 tentang Penyelenggaraan Haji dan Umrah. Kebijakan ini membuka peluang bagi calon jamaah untuk mengatur sendiri seluruh keperluan umrahâ€”mulai dari tiket, visa, hingga akomodasiâ€”tanpa harus melalui biro perjalanan. Regulasi turunannya sedang disiapkan agar pelaksanaan umrah mandiri tetap aman, terpantau, dan sesuai standar. Namun, kebijakan ini memicu reaksi beragam. Sejumlah biro travel merasa khawati",0
"Bupati Pati Sudewo batal dimakzulkan setelah mayoritas fraksi DPRD Pati memutuskan untuk memberikan 'kesempatan kedua' kepada Sudewo. Kementerian Dalam Negeri (Kemendagri) menghormati keputusan DPRD Pati. ""Kemendagri sedari awal menghormati proses politik berdasarkan undang-undang yang ada di DPRD. Keputusan DPRD untuk memilih melakukan perbaikan tentu kita hormati. Ini pelajaran mahal untuk semua pimpinan di daerah,"" kata Wamendagri Bima Arya saat dihubungi, Minggu (2/11/2025). Bima menyebut Me",0
"Banjir setinggi hampir satu meter sempat melanda kawasan Kemang, Jakarta Selatan, hingga menyebabkan kemacetan panjang. Warga pun harus menempuh perjuangan ekstra untuk melewati antrean kendaraan yang nyaris tak bergerak. Dirangkum detikcom, Minggu (2/11/2025), kemacetan itu terjadi pada Rabu dan Kamis lalu. Hal itu lantaran disebabkan oleh banjir setinggi hampir satu meter. ""Karena Kemang Raya itu banjir satu meter ketinggian satu meter tampaknya sampai ke Kemang Raya termasuk terdampak ke Bang",-1
"Satres Narkoba Polres Metro Jakarta Barat menangkap Onadio Leonardo atau yang akrab disapa Onad. Onad ditangkap terkait kasus penyalahgunaan narkotika. Kasie Humas Polres Metro Jakarta Barat AKP Wisnu menjelaskan kasus tersebut terungkap setelah polisi menangkap KR pada Rabu (29/10) di Sunter, Tanjung Priok, Jakarta Utara. KR diduga menjual barang haram tersebut kepada Onad. ""Inisial KR, itu diamankan di Sunter. Perannya sebagai orang yang kasih barang narkotika ke OL,"" kata Wisnu saat dihubungi",-1
"Presiden Amerika Serikat (AS) Donald Trump mengancam akan mengirimkan pasukan bersenjata AS ke Nigeria. Ia menyampaikan ancaman itu untuk merespons menghentikan apa yang ia sebut sebagai pembunuhan umat Kristen oleh kelompok teroris. Dilansir AFP, Minggu (2/11/2025), dalam sebuah unggahan yang menggemparkan di platform Truth Social, Trump mengatakan telah meminta Pentagon untuk memetakan kemungkinan rencana serangan, sehari setelah memperingatkan bahwa agama Kristen ""menghadapi ancaman eksistens",-1
"Rahasia makam Firaun muda akhirnya terbuka. Piramida Agung Giza, Museum Agung Mesir yang telah lama dinantikan kini resmi membuka pintunya untuk publik. Dirangkum detikcom sebagaimana laporan BBC, Minggu (2/11/2025), Museum Agung Mesir itu berdiri di atas kompleks raksasa seluas 120 hektare. Luas itu dua kali lipat ukuran Museum Louvre di Prancis. Di museum itu, ada sekitar 70.000 hingga 100.000 artefak yang dipamerkan. Termasuk, harta karun yang belum pernah terlihat dari makam Firaun muda, Tut",0
"Gempa berkekuatan magnitudo (M) 4,9 terjadi di Meulaboh, Aceh Barat. Gempa berpusat di laut. BMKG melaporkan gempa terjadi, Minggu (2/11/2025), pukul 04.00 WIB. Gempa terjadi pada kedalaman 28 kilometer. ""Pusat gempa berada di laut 31 km barat daya Meulaboh, Aceh Barat,"" tulis @infoBMKG.  SCROLL TO CONTINUE WITH CONTENT   Titik koordinat gempa berada di 3,94 lintang utara (LU) dan 95,93 bujur timur (BT). Kekuatan gempa tercatat MMI III-IV di Meulaboh, MMI III di Aceh Barat Daya, MMI III di Cal",0
"Pemprov DKI Jakarta menyampaikan prakiraan cuaca hari ini. Diprediksi hari ini sejumlah wilayah akan mengalami hujan ringan pada siang hari. Berdasarkan data BMKG yang disampaikan Pemprov Jakarta, prakiraan cuaca pada Minggu (2/11/2025) di wilayah Jakarta Barat (Jakbar), Jakarta Pusat (Jakpus) dan Jakarta Selatan (Jaksel) akan turun hujan ringan pada pukul 13.00 WIB.   SCROLL TO CONTINUE WITH CONTENT  Hujan ringan di Jaksel diprediksi dimulai pukul 07.00 WIB, pukul 10.00 WIB, pukul 13.00 WIB d",0
"Ukraina mengerahkan pasukan khusus ke kota Pokrovsk di timur Ukraina. Kota tersebut kini berada di bawah tekanan akibat serangan gencar Rusia yang melibatkan ribuan tentara. Dilansir AFP, Minggu (2/11/2025), Pokrovsk, di wilayah Donetsk, Ukraina, terletak di jalur pasokan utama bagi tentara Ukraina dan telah menjadi incaran Moskow selama lebih dari setahun. Ratusan tentara Rusia telah menyusup ke pusat logistik kota tersebut.   SCROLL TO CONTINUE WITH CONTENT  Tentara lainnya mendekati pinggir",0
"Satu unit truk tangki BBM terguling di Jalan Perintis Kemerdekaan, Kecamatan Cilaku, Kabupaten Cianjur. Kecelakaan itu menyebabkan truk tangki terbakar hebat hingga menghanguskan pos polisi, ruko, dan kendaraan lain di dekatnya. Dilansir detikJabar, kecelakaan berujung kebakaran hebat itu terjadi Sabtu (1/11) malam. Hingga pukul 22.47 WIB, api masih terlihat di badan truk hingga pos polisi yang berjarak sekitar 40 meter.   SCROLL TO CONTINUE WITH CONTENT  Sejumlah mobil pemadam dan kendaraan t",-1
"Tanah longsor akibat hujan deras terjang wilayah Kenya barat. Imbas insiden tersebut, 21 orang dilaporkan tewas dan 30 orang masih hilang. Dilansir AFP, Minggu (2/11/2025), insiden ini dilaporkan langsung oleh Menteri Dalam Negeri Kenya Kipchumba Murkomen. Ia mengatakan sebanyak 21 orang tewas imbas longsor. ""Kami telah mengonfirmasi hilangnya 21 orang akibat tragedi ini,"" kata Kupchumba lewat media sosialnya.  SCROLL TO CONTINUE WITH CONTENT   Selain itu, ia menyebut sampai saat ini 30 orang",0
"Direktur Jenderal Perhubungan Darat (Dirjen Hubdat), Aan Suhanan, akan melakukan pengecekan terminal hingga lokasi rawan kecelakaan secara serentak pada 7 November mendatang. Salah satu yang ia cek yakni Terminal Tipe A Tidar, Magelang, Jawa Tengah. ""Kami telah memeriksa 5 bus yang berada di lokasi parkir wisata borobudur hari ini. Alhamdulillah semuanya setelah dicek telah memenuhi persyaratan teknis dan laik jalan,"" kata Aan Suhanan saat meninjau langsung pelaksanaan rampcheck, dalam keteranga",0
"Polres Kampar melalui Polsek Kampar Kiri melakukan penindakan tegas terhadap aktivitas penambangan emas tanpa izin (PETI) di aliran Sungai Setingkat, Desa Sungai Raja, Kecamatan Kampar Kiri. Dalam operasi ini, polisi menyita 7 unit rakit PETI. Operasi tersebut digelar di sepanjang Sungai Setingkat, Kampar Kiri, Kabupaten Kampar, pada Sabtu (1/11/2025). Penindakan ini dipimpin langsung oleh Kapolsek Kampar Kiri, Kompol Rusyandi Z. Siregar, didampingi Kanit Reskrim AKP Khamry Gufron, serta melibat",1
"Bareskrim Polri melakukan penggerebekan tambang ilegal di wilayah Kecamatan Srumbung, Kabupaten Magelang. Tambang ilegal yang berada di lereng Gunung Merapi itu disebut punya nilai transaksi capai Rp 3 triliun. Dilansir detikJateng, Minggu (2/11/2025), penggerebekan itu terjadi pada Sabtu (1/11) kemarin. Dari penggerebekan itu ditemukan kurang lebih 39 depo yang menampung dari 36 titik tambang ilegal dengan transaksi mencapai Rp 3 triliun. ""Rekan-rekan ketahui, kurang lebih kerugian yang, uang y",0
"Sejarawan David Van Reybrouck mengkritik wacana menjadikan Presiden ke-2 RI Soeharto sebagai pahlawan nasional. Ia menilai usulan itu seperti memberikan nobel perdamaian untuk Presiden Amerika Serikat (AS) Donald Trump. Hal itu disampaikan David dalam Forum diskusi di Ubud Writers and Readers Festival 2025 di Taman Baca Ubud yang dihadiri ratusan peserta dari mancanegara. Ia menyinggung sejarah kelam pelanggaran hak asasi manusia dan represi politik pada masa Orde Baru. ""Menjadikan diktator mili",0
"Polres Rokan Hulu (Rohul) melanjutkan komitmen dalam upaya mendukung program Polda Riau, Green Policing. Polres Rohul dan polsek jajaran melaksanakan penanaman pohon secara serentak di 22 lokasi. Kegiatan ini menjadi wujud nyata komitmen Polda Riau, khususnya Polres Rokan Hulu, dalam menjaga kelestarian lingkungan, melindungi tuah alam, dan mewariskan nilai-nilai kelestarian bagi generasi yang akan datang. Kapolres Rokan Hulu AKBP Emil Eka Putra menyampaikan bahwa kegiatan ini merupakan bagian d",1
"Polres Dumai melalui Polsek Sungai Sembilan terus mengimplementasikan program Green Policing dengan fokus menyasar edukasi lingkungan sejak usia dini. Polisi melaksanakan kegiatan penyuluhan dan penanaman pohon bersama siswa-siswi Taman Kanak-Kanak (TK) Maryam Macora di Kelurahan Bangsal Aceh, Kecamatan Sungai Sembilan. Kegiatan edukasi ini dihadiri oleh Kanit Provost Polsek Sungai Sembilan, Aiptu Budi Asmara, Bhabinkamtibmas Kelurahan Lubuk Gaung, Aipda Dedityawarman, Ba Unit Reskrim Polsek Sun",1
"Ketua Komisi XI DPR RI Mukhamad Misbakhun bicara terkait tokenisasi aset nyata atau real world assets (RAW). Ia mendorong masyarakat memahami konsep tersebut agar bisa membantu pembangunan nasional. Legislator Partai Golkar itu menyampaikan hal tersebut saat menjadi leader speaker pada Festival Ekonomi Keuangan Digital Indonesia (FEKDI) dan Indonesia Fintech Summit & Expo (IFSE) 2025 di Jakarta Convention Center, Jumat (31/10) lalu. Di acara tersebut, Misbakhun menjelaskan tokenisasi RWA memungk",0
"Polres Metro Tangerang Kota berbagi sembako dengan masyarakat di kawasan Banksasuci, Kelurahan Penunggangan Barat, Kecamatan Cibodas, Kota Tangerang lewat program 'Jumat Peduli'. Kegiatan ini merupakan wujud kepedulian Polri terhadap masyarakat. ""Jumat Peduli adalah program Kapolda Metro Jaya, sebagai bentuk kepedulian Polri terhadap masyarakat. Dengan kegiatan ini, diharapkan semakin mempererat hubungan masyarakat dengan Polri,"" kata Kapolres Metro Tangerang Kota Kombes Raden Muhammad Jauhari,",1
"Kapan puncak musim hujan di Indonesia akan terjadi? Kepala Badan Meteorologi, Klimatologi, dan Geofisika (BMKG) Dwikorita Karnawati memberikan jawaban berikut ini... ""Saat ini (puncak musim hujan) mulai November hingga Februari dengan pola umum pergerakan dari arah barat ke timur.Artinya terjadinya puncak musim hujan itu tidak serempak,"" jelas Dwikorita dalam konferensi pers yang digelar Sabtu (1/11). ""Namun, fase puncak musim hujan utama... Jadi puncaknya puncak. Fase puncak musim hujan utama d",0
"Presiden Korea Selatan sekaligus Ketua APEC 2025, Lee Jae-myung, sempat membahas Konferensi Asia-Afrika (KAA) saat KTT APEC. Ia mengatakan Korsel banyak belajar dari Indonesia terutama nilai-nilai 'Bandung Spirit' 1955. ""Kita semua telah belajar dari sejarah bahwa Indonesia yang meng-inisiasi KAA/ Konferensi Asia Afrika dan telah memimpin pembentukan Dasasila atau semangat Bandung. Jika kita melihat elemen-elemen kunci dari semangat Bandung, itu adalah keseimbangan, dan nilai-nilai ini merupakan",0
"Venezuela khawatir peningkatan kekuatan militer Amerika Serikat (AS) di wilayah Karibia bertujuan untuk menyerangnya. Presiden AS Donald Trump menjawab singkat dan membantah tuduhan tersebut. Dilansir kantor berita AFP, Sabtu (1/11/2025), Amerika Serikat telah mengerahkan delapan kapal Angkatan Laut AS ke Karibia dan mengirim pesawat tempur siluman F-35 ke Puerto Riko. Selain itu, kapal induk bergerak ke wilayah tersebut dengan alasan untuk mengendalikan perdagangan narkoba. ""Tidak,"" jawab Trump",0
"Bareskrim Polri bersama tim gabungan dari Dinas ESDM Provinsi Jawa Tengah menggerebek tambang pasir ilegal di Kecamatan Srumbung, Kabupaten Magelang. Disebutkan aktivitas penambangan ilegal itu merugikan negara hingga Rp 3 triliun. Dari operasi ini polisi menemukan kurang lebih 39 depo yang menampung hasil dari 36 titik tambang ilegal di lokasi yang digerebek. Selain itu ditemukan juga 5 ekskavator dan 1 truk pengangkut.",0
"Sekelompok orang bersenjata melakukan penembakan ke sejumlah rumah di Pulau Kreta, Yunani. Insiden penembakan itu menewaskan 2 orang dan menyebabkan puluhan orang terluka. Dilansir AFP, Sabtu (1/11/2025), penembakan itu diduga terkait dengan dendam keluarga. Kantor berita pemerintah ANA mengatakan setidaknya dua orang, termasuk seorang perempuan berusia 50 tahun, tewas setelah orang-orang bersenjata menembaki rumah-rumah di desa Vorizia, sekitar 52 kilometer (32 mil) barat daya ibu kota pulau te",-1
"Polisi mengungkapkan sosok dengan inisial KR sebagai pemasok narkoba ke Onadio Leonardo alias Onad. KR ditangkap di kawasan Sunter, Tanjung Priok, Jakarta Utara. ""Untuk barang bukti yang didapat dari inisial KR, yang diamankan di Sunter, di antaranya narkotika jenis ekstasi dan sabu dalam plastik klip,"" jelas Kasi Humas Polres Metro Jakarta Barat AKP Wisnu. Berikut pernyataan lengkap dari pihak kepolisian... Tonton juga berita video lainnya di sini!",0
"Komandan Resort Militer (Danrem) 031/Wira Bima, Brigjen TNI Jarot Suprihanto, melakukan kunjungan dalam rangka mempererat sinergi TNI dan Polri. Dalam kunjungan itu, Brigjen TNI Jarot melakukan penanaman pohon dalam mendukung program Polda Riau, Green Policing. Kunjungan Danrem ini disambut hangat oleh Kapolres Siak AKBP Eka Ariandy Putra, Jumat (31/10/2025). Pada kesempatan itu, Brigjen Jarot dan AKBP Eka melakukan penanaman pohon secara simbolis di halaman Mapolres Siak. AKBP Eka menyampaikan",1
"Ketum PDIP yang sekaligus Presiden ke-5 RI Megawati Soekarnoputri mengungkap hubungannya dengan Presiden Prabowo Subianto saat ini. Megawati mengatakan ia dan Prabowo akrab. ""Loh saya kan sudah merasa jadi presiden, kekuatan itu berapa jam sih? Itu lho kok, eh jangan dipikir loh, Mas, nanti jadi ruang ini, Ibu Mega ini nggituin Pak Bowo, nggak. Saya sama Mas Bowo itu akrab, tahu ndak? Jangan Anda coba-coba,"" kata Megawati saat menjadi keynote speaker seminar internasional dalam rangka peringatan",0
Seorang pemotor wanita bikin heboh karena masuk Tol Cikampek dan berkendara tanpa menggunakan helm. Ia pun berujung dikejar mobil patroli polisi. Disebutkan peristiwa ini terjadi pada hari Kamis (30/10). Wanita itu pun berhasil ditangkap di Kilometer 63 A dan dibawa ke Gerbang Tol Cikatama.,0
"Ketua Umum Projo, Budi Arie Setiadi, menegaskan organisasinya tidak akan berubah menjadi partai politik. Namun, kata Budi, Projo akan bertransformasi dengan perubahaan logo Projo dari yang saat ini berupa siluet Presiden ke-7 RI Joko Widodo.",0
"Ketua Harian DPP Partai Gerindra, Sufmi Dasco Ahmad, menanggapi sinyal dari Ketum Projo Budi Arie Setiadi yang ingin bergabung ke partainya. Dasco mengaku belum mendengar itu langsung dari Budi Arie. Diketahui sebelumnya Budi Arie sudah menyampaikan keinginannya itu dan meminta izin ke relawan Projo. Hal ini terjadi saat penyampaian sambutan dalam Kongres Projo ke-III, Sabtu (1/11).",0
"Wakil Menteri Transmigrasi Viva Yoga Mauladi mengatakan warga transmigran akan mendapatkan hak pengelolaan lahan (HPL) dan jaminan hidup dari negara di kawasan transmigrasi. Hal ini dilakukan untuk memastikan kesejahteraan dan kemandirian mereka. Menurut Viva, setiap warga transmigrasi atau kepala keluarga transmigran ini akan memperoleh lahan tersebut sesuai ketentuan wilayah masing-masing sebagai bagian dari tanggung jawab negara. ""Ya, mereka mendapat lahan 1-2 hektare, tergantung wilayahnya.",1
"Pada hari ini, Sabtu (1/11), ada konser BLACKPINK dan HYDE di area Gelora Bung Karno (GBK). Pantauan 20Detik menjelang konser berlangsung, situasi lalu lintas di Jalan Asia Afrika menuju Palmerah tepantau padat merayap. Sedangkan arah sebaliknya (menuju Plaza Senayan) ramai lancar. Berikut situasinya... Tonton video lainnya di sini ya!",0
Kemelekatan manusia dengan handphone (HP) saat ini menjadi perhatian khusus bagi Presiden ke-5 RI sekaligus Ketua Umum PDIP Megawati Soekarnoputri. Megawati bahkan mengaku ogah memiliki telepon seluler. Megawati bercerita soal alasannya tak memiliki HP sampai saat ini. Megawati mengatakan dirinya adalah sosok yang banyak dicari dan banyak orang ingin tahu tentang dirinya. Hal itu disampaikan Megawati saat menjadi pembicara kunci (keynote speaker) dalam seminar internasional peringatan ke-70 tahu,0
"Pengeroyokan terhadap pria berinisial B dan wanita berinisial DS terjadi di Kamal Muara, Penjaringan, Jakarta Utara (Jakut). Keduanya dikeroyok oleh sejumlah orang. ""Awal kejadian ketika Pelapor bersama Saksi sedang berjalan kaki, tiba-tiba datang mobil sedan BMW yang dikendarai salah satu pelaku hampir menabrak Pelapor dan Saksi,"" kata Kasubbid Penmas Bidhumas Polda Metro Jaya AKBP Reonald Simanjuntak, Sabtu (1/11/2025).   SCROLL TO CONTINUE WITH CONTENT  Reonald menyebut peristiwa itu terjad",0
"Artis Onadio Leonardo (Onad) ditangkap di rumahnya di kawasan Rempoa, Ciputat Timur, Tangerang Selatan, terkait kasus narkoba. Ia menjalani tes urine dan hasilnya dinyatakan positif mengonsumsi narkoba. ""(Hasil tes urine) positif jenis ganja dan ekstasi,"" ujar Kasi Humas Polres Metro Jakarta Barat AKP Wisnu, kepada wartawan, Sabtu (1/11/2025). Sementara itu, Wisnu belum bisa memastikan status Onad dalam kasus tersebut. Ia mengatakan Onad saat ini masih menjalani pemeriksaan.  SCROLL TO CONTINUE",0
"Dua truk mengalami kecelakaan mengerikan di kawasan Medan Satria, Kota Bekasi, Jawa Barat. Salah satu truk bahkan gepeng setelah menabrak truk kontainer dari belakang. Dalam video yang beredar di media sosial, Sabtu (1/11/2025), terlihat truk berwarna putih ringsek parah di bagian depan setelah menabrak truk kontainer merah. Kondisi kabin truk nyaris gepeng akibat benturan keras. Untuk mengevakuasi truk tersebut, petugas menggunakan alat berat forklift. Forklift tampak mengangkat bagian kontaine",0
"Jakarta - Luapan sungai akibat sampah menyumbat rendam 895 rumah di Rowokangkung, Lumajang. Pemkab lakukan normalisasi dan bantu korban banjir. Petugas menggunakan alat berat mengangkut sampah yang menyumbat aliran sungai sehingga menyebabkan banjir di Rowokangkung, Lumajang, Jawa Timur, Sabtu (1/11/2025). Foto: ANTARA FOTO/Irfan Sumanjaya Pemkab Lumajang memberikan bantuan air bersih dan makanan siap saji untuk korban banjir serta melakukan normalisasi sejumlah sungai karena luapan airnya telah",0
"Menteri Dalam Negeri (Mendagri), Tito Karnavian meraih penghargaan Outstanding in Governance and Regional Equity dalam ajang bergengsi CNN Indonesia Awards 2025 yang digelar di Ritz Carlton Mega Kuningan, Jakarta, Jumat (31/10) kemarin. Penghargaan tersebut diserahkan langsung oleh Pendiri CT Corp, Chairul Tanjung (CT) sebagai bentuk apresiasi atas kepemimpinan Tito dalam memperkuat sinergi antara pemerintah pusat dan daerah. Sebagai Mendagri, Tito dinilai berhasil memastikan kebijakan nasional",1
"Sekjen PDIP Hasto Kristiyanto menanggapi polemik persoalan utang Kereta Cepat Whoosh. Hasto menyinggung urgensi membangun kereta cepat. ""Ya kalau kita lihat, kemarin kami laporkan kepada Ibu Megawati Soekarnoputri dan saya menjadi saksi, bagaimana Ibu Mega berulang kali menyampaikan bahwa apakah rakyat memerlukan kereta api cepat tersebut,"" kata Hasto Kristiyanto usai di makam Bung Karno, Blitar, Jawa Timur, Sabtu (1/11/2025).   SCROLL TO CONTINUE WITH CONTENT  Hasto menyoroti kebutuhan rakyat",0
"Wakil Menteri Dalam Negeri (Wamendagri), Bima Arya Sugiarto menegaskan dua target utama yang diharapkan Presiden Prabowo Subianto melalui program Makan Bergizi Gratis (MBG), yakni peningkatan kesehatan dan kesejahteraan masyarakat. ""Dengan kunjungan ke Baubau ini, saya senang sekali dapat kesempatan untuk menyemangati teman-teman di sini, supaya betul-betul bisa memenuhi dua target tadi,"" ujar Bima dalam keterangan tertulis, Sabtu (1/11/2025). Hal itu disampaikannya saat meresmikan Gedung Satuan",0
"Tulisan ini saya buat untuk membantu masyarakat memahami bahwa tarif air PAM Jaya sejatinya sangat murah dibandingkan dengan tarif air di berbagai PDAM lainnya. Bahkan, harga air PAM Jaya jauh lebih murah jika dibandingkan dengan harga Air Minum Dalam Kemasan (AMDK) dan produk air minum lainnya. Sebagai ilustrasi, harga satu botol AMDK berukuran 1,5 liter bisa mencapai sekitar Rp5.000. Sementara itu, tarif air minum PAM Jaya untuk kelompok Rumah Tangga Sangat Sederhana (RTSS) hanya Rp 1.000 per",0
"Presiden Prabowo Subianto tiba di Tanah Air setelah menghadiri Konferensi Tingkat Tinggi (KTT) Kerja Sama Ekonomi Asia Pasifik (APEC) 2025 di Gyeongju, Korea Selatan. Ia tiba di Lanud Halim Perdanakusuma, Jakarta Timur pukul 18.50 WIB. Tiba menggunakan pesawat Garuda Indonesia-1, Prabowo disambut Mensesneg Prasetyo Hadi di landasan. Diketahui dalam perjalanan ini Prabowo didampingi Menteri Luar Negeri Sugiono dan Sekretaris Kabinet Teddy Indra Wijaya.",0
