Title,Source,Link
"Tegang, Canberra Tuduh Jet China Ganggu Pesawat Mata-mata Australia",CNN Indonesia,https://www.cnnindonesia.com/internasional/20251020194230-113-1286618/tegang-canberra-tuduh-jet-china-ganggu-pesawat-mata-mata-australia
Rosan Sebut Rp750 T Dividen BUMN Bakal Diinvestasikan dalam 5 Tahun,CNN Indonesia,https://www.cnnindonesia.com/ekonomi/20251020134135-92-1286458/rosan-sebut-rp750-t-dividen-bumn-bakal-diinvestasikan-dalam-5-tahun
"Bus Tabrak Warung di Labuanbatu Selatan Sumut, Lima Orang Terluka",CNN Indonesia,https://www.cnnindonesia.com/nasional/20251020193935-20-1286617/bus-tabrak-warung-di-labuanbatu-selatan-sumut-lima-orang-terluka
FOTO: Gemas! Momen Anjing-anjing Ikut Parade Halloween,CNN Indonesia,https://www.cnnindonesia.com/gaya-hidup/20251020070646-279-1286291/foto-gemas-momen-anjing-anjing-ikut-parade-halloween
Buruh soal Luhut Minta Prabowo Tak Disetir soal UMP: Cara Kami Sah,CNN Indonesia,https://www.cnnindonesia.com/ekonomi/20251020094016-92-1286341/buruh-soal-luhut-minta-prabowo-tak-disetir-soal-ump-cara-kami-sah
"FOTO: Demo Satu Tahun Prabowo-Gibran, Massa Sampaikan 17 Tuntutan",CNN Indonesia,https://www.cnnindonesia.com/nasional/20251020183208-22-1286594/foto-demo-satu-tahun-prabowo-gibran-massa-sampaikan-17-tuntutan
"VIDEO: Pimpin Sidang Paripurna, Prabowo Kembali Puji Jokowi",CNN Indonesia,https://www.cnnindonesia.com/tv/20251020181344-400-1286584/video-pimpin-sidang-paripurna-prabowo-kembali-puji-jokowi
Malaysia Diminta Contoh Indonesia yang Nyaris ke Piala Dunia,CNN Indonesia,https://www.cnnindonesia.com/olahraga/20251020175718-142-1286578/malaysia-diminta-contoh-indonesia-yang-nyaris-ke-piala-dunia
Pemerintah: Hanya 1 Kontainer Cengkeh Suspek Paparan Radiasi Cesium,CNN Indonesia,https://www.cnnindonesia.com/ekonomi/20251020155201-92-1286532/pemerintah-hanya-1-kontainer-cengkeh-suspek-paparan-radiasi-cesium
"VIDEO: Geger Layanan Cloud AWS Down, Amazon hingga Roblox Lumpuh",CNN Indonesia,https://www.cnnindonesia.com/teknologi/20251020184127-189-1286609/video-geger-layanan-cloud-aws-down-amazon-hingga-roblox-lumpuh
Ini Syarat dan Ketentuan Lomba Video Hidden Gem 2025 BAKTI Komdigi,CNN Indonesia,https://www.cnnindonesia.com/teknologi/20250922152647-190-1276407/ini-syarat-dan-ketentuan-lomba-video-hidden-gem-2025-bakti-komdigi
"Sinopsis Charlie's Angels 2, Bioskop Trans TV 20 Oktober 2025",CNN Indonesia,https://www.cnnindonesia.com/hiburan/20251020113659-220-1286397/sinopsis-charlies-angels-2-bioskop-trans-tv-20-oktober-2025
Setahun Prabowo dan Relasi Politik dengan Jokowi,CNN Indonesia,https://www.cnnindonesia.com/nasional/20251020081855-32-1286311/setahun-prabowo-dan-relasi-politik-dengan-jokowi
4 Buah yang Sebaiknya Dimakan dengan Kulitnya,CNN Indonesia,https://www.cnnindonesia.com/gaya-hidup/20251020144132-262-1286490/4-buah-yang-sebaiknya-dimakan-dengan-kulitnya
Delapan Peristiwa Penting selama Setahun Prabowo-Gibran,CNN Indonesia,https://www.cnnindonesia.com/nasional/20251020064919-20-1286280/delapan-peristiwa-penting-selama-setahun-prabowo-gibran
Warga Australia 'Panic Buying' Ramai-ramai Borong Emas,CNN Indonesia,https://www.cnnindonesia.com/internasional/20251020183521-113-1286607/warga-australia-panic-buying-ramai-ramai-borong-emas
VIDEO: Detik-detik Rumah Berpenghuni Enam Orang Ambruk,CNN Indonesia,https://www.cnnindonesia.com/tv/20251020175642-400-1286577/video-detik-detik-rumah-berpenghuni-enam-orang-ambruk
"Usia Pemerintahan Setahun, Prabowo 3 Kali Rombak Kabinet",CNN Indonesia,https://www.cnnindonesia.com/nasional/20251016113518-32-1285170/usia-pemerintahan-setahun-prabowo-3-kali-rombak-kabinet
"Viral Warung Epy Kusnandar Didatangi Preman, Polisi Turun Tangan",CNN Indonesia,https://www.cnnindonesia.com/nasional/20251020185537-12-1286612/viral-warung-epy-kusnandar-didatangi-preman-polisi-turun-tangan
KPK Sita Mobil Seharga Rp1 Miliar di Kasus CSR BI Heri Gunawan,CNN Indonesia,https://www.cnnindonesia.com/nasional/20251020180855-12-1286581/kpk-sita-mobil-seharga-rp1-miliar-di-kasus-csr-bi-heri-gunawan
Daftar 8 Tuntutan BEM UI di Demo 1 Tahun Prabowo-Gibran,CNN Indonesia,https://www.cnnindonesia.com/nasional/20251020171857-20-1286568/daftar-8-tuntutan-bem-ui-di-demo-1-tahun-prabowo-gibran
Kemenimipas Torehkan Kenaikan PNBP Tertinggi Sepanjang 2025,CNN Indonesia,https://www.cnnindonesia.com/nasional/20251020181906-25-1286586/kemenimipas-torehkan-kenaikan-pnbp-tertinggi-sepanjang-2025
Respons TransJakarta soal Pernyataan Salah Satu Komisaris Saat Orasi,CNN Indonesia,https://www.cnnindonesia.com/ekonomi/20251020174423-92-1286573/respons-transjakarta-soal-pernyataan-salah-satu-komisaris-saat-orasi
"Demo 1 Tahun Prabowo-Gibran Bubar, Ada Aksi Bakar Ban & Saling Dorong",CNN Indonesia,https://www.cnnindonesia.com/nasional/20251020182931-20-1286591/demo-1-tahun-prabowo-gibran-bubar-ada-aksi-bakar-ban-saling-dorong
Prabowo: Indonesia Bakal Punya Mobil Buatan Lokal 3 Tahun Lagi,CNN Indonesia,https://www.cnnindonesia.com/otomotif/20251020183038-587-1286592/prabowo-indonesia-bakal-punya-mobil-buatan-lokal-3-tahun-lagi
Prabowo Minta Anak Buah Pakai Mobil Maung,CNN Indonesia,https://www.cnnindonesia.com/nasional/20251020182457-20-1286589/prabowo-minta-anak-buah-pakai-mobil-maung
"Inggris Ketahuan Tutupi Pertemuan 'Rahasia' Menlu Israel, Kenapa?",CNN Indonesia,https://www.cnnindonesia.com/internasional/20251020161311-120-1286546/inggris-ketahuan-tutupi-pertemuan-rahasia-menlu-israel-kenapa
VIDEO: Prabowo Puji Cara Jokowi Kendalikan Inflasi,CNN Indonesia,https://www.cnnindonesia.com/nasional/20251020171243-36-1286558/video-prabowo-puji-cara-jokowi-kendalikan-inflasi
Apakah TKA Wajib untuk Masuk Kuliah? Begini Penjelasannya,CNN Indonesia,https://www.cnnindonesia.com/edukasi/20251013125618-569-1283933/apakah-tka-wajib-untuk-masuk-kuliah-begini-penjelasannya
"Dilema Guru Hadapi Polah 'Ajaib' Siswa, Harus Gimana?",CNN Indonesia,https://www.cnnindonesia.com/gaya-hidup/20251020154300-284-1286525/dilema-guru-hadapi-polah-ajaib-siswa-harus-gimana
"Video: Dari Osaka Expo 2025, Indonesia Raih Investasi USD 28 Miliar",CNBC Indonesia,https://www.cnbcindonesia.com/news/20251020172553-8-677632/video-dari-osaka-expo-2025-indonesia-raih-investasi-usd-28-miliar
"Kisah Pasangan Rampok Uang Rp 1,2 Triliun, Modusnya Tak Terduga",CNBC Indonesia,https://www.cnbcindonesia.com/tech/20251020152411-37-677559/kisah-pasangan-rampok-uang-rp-12-triliun-modusnya-tak-terduga
"Soal Sumur Rakyat, Bahlil: Sudah Punya Warga dari Zaman Belanda",CNBC Indonesia,https://www.cnbcindonesia.com/news/20251020194711-4-677673/soal-sumur-rakyat-bahlil-sudah-punya-warga-dari-zaman-belanda
Peringati Satu Tahun Kepemimpinan Prabowo Kementrans Gelar Open House,CNBC Indonesia,https://www.cnbcindonesia.com/news/20251020184648-8-677648/peringati-satu-tahun-kepemimpinan-prabowo-kementrans-gelar-open-house
Video: Tambang Ilegal Bikin Rugi Rp800 T - Warga India Borong Perak,CNBC Indonesia,https://www.cnbcindonesia.com/news/20251020172729-8-677631/video-tambang-ilegal-bikin-rugi-rp800-t--warga-india-borong-perak
"Media Asing Tiba-Tiba Sorot Bali, Laporkan Fenomena Ini",CNBC Indonesia,https://www.cnbcindonesia.com/news/20251020132507-4-677475/media-asing-tiba-tiba-sorot-bali-laporkan-fenomena-ini
"Bahlil Beberkan Alasan Prioritas Tambang untuk UMKM, Koperasi-Ormas",CNBC Indonesia,https://www.cnbcindonesia.com/news/20251020184541-4-677647/bahlil-beberkan-alasan-prioritas-tambang-untuk-umkm-koperasi-ormas
"Ada Oknum Tak Ingin Hilirisasi RI Maju, Bahlil: Karena Sudah Nyaman!",CNBC Indonesia,https://www.cnbcindonesia.com/news/20251020154902-4-677573/ada-oknum-tak-ingin-hilirisasi-ri-maju-bahlil-karena-sudah-nyaman
Berita Duka! Pendiri Tempo Scan Kartini Muljadi Meninggal Dunia,CNBC Indonesia,https://www.cnbcindonesia.com/market/20251020194256-17-677672/berita-duka-pendiri-tempo-scan-kartini-muljadi-meninggal-dunia
"Punya Modal Besar Ini, Industri Halal RI Coba Kalahkan Arab & Malaysia",CNBC Indonesia,https://www.cnbcindonesia.com/news/20251020185616-4-677654/punya-modal-besar-ini-industri-halal-ri-coba-kalahkan-arab-malaysia
Detik-Detik Sultan Brunei Hassanal Bolkiah Terjatuh di Atas Panggung,CNBC Indonesia,https://www.cnbcindonesia.com/news/20251020150248-7-677543/detik-detik-sultan-brunei-hassanal-bolkiah-terjatuh-di-atas-panggung
"Israel Langgar Gencatan Senjata Gaza, Trump Beri Respons Tak Terduga",CNBC Indonesia,https://www.cnbcindonesia.com/news/20251020131726-4-677472/israel-langgar-gencatan-senjata-gaza-trump-beri-respons-tak-terduga
Gunung Berapi Bangkit usai Tertidur Selama 700.000 Tahun,CNBC Indonesia,https://www.cnbcindonesia.com/lifestyle/20251020093411-33-677357/gunung-berapi-bangkit-usai-tertidur-selama-700000-tahun
"Tiba-tiba Muncul Gunung Baru di Jawa, Ahli Geologi Beri Penjelasan",CNBC Indonesia,https://www.cnbcindonesia.com/tech/20251020130121-37-677460/tiba-tiba-muncul-gunung-baru-di-jawa-ahli-geologi-beri-penjelasan
"Potret Pesawat Emirates Boeing 747 Jatuh ke Laut, Hidung & Ekor Pisah",CNBC Indonesia,https://www.cnbcindonesia.com/news/20251020084710-7-677329/potret-pesawat-emirates-boeing-747-jatuh-ke-laut-hidung-ekor-pisah
"Prabowo Ungkap The Invisible People di RI, Beri Peringatan ke Menteri",CNBC Indonesia,https://www.cnbcindonesia.com/news/20251020180641-4-677638/prabowo-ungkap-the-invisible-people-di-ri-beri-peringatan-ke-menteri
90% Proyek Hilirisasi RI Sampai 2040 Berasal dari Tambang,CNBC Indonesia,https://www.cnbcindonesia.com/news/20251020150715-4-677548/90-proyek-hilirisasi-ri-sampai-2040-berasal-dari-tambang
"Warga RI Buruan Aktifkan Akun, Biar Bisa Lapor SPT 2025 di Coretax",CNBC Indonesia,https://www.cnbcindonesia.com/news/20251020181324-4-677651/warga-ri-buruan-aktifkan-akun-biar-bisa-lapor-spt-2025-di-coretax
"Setahun Prabowo-Gibran, Kawasan Industri Baru RI Tambah 9",CNBC Indonesia,https://www.cnbcindonesia.com/news/20251020181359-4-677641/setahun-prabowo-gibran-kawasan-industri-baru-ri-tambah-9
"Air Hujan Jakarta Mengandung Mikroplastik, Ahli Jelaskan Penyebabnya",CNBC Indonesia,https://www.cnbcindonesia.com/lifestyle/20251020160238-33-677581/air-hujan-jakarta-mengandung-mikroplastik-ahli-jelaskan-penyebabnya
"TNI Siap Kirim 20.000 Personel ke Gaza, Prabowo: Kita Tak Boleh Lugu",CNBC Indonesia,https://www.cnbcindonesia.com/news/20251020175407-4-677634/tni-siap-kirim-20000-personel-ke-gaza-prabowo-kita-tak-boleh-lugu
"Nomor XL Hangus Bisa Aktif Lagi, Caranya Mudah",CNBC Indonesia,https://www.cnbcindonesia.com/tech/20251020153018-37-677562/nomor-xl-hangus-bisa-aktif-lagi-caranya-mudah
"Manufaktur RI Memang Tumbuh, Tapi Menperin Akui Kalah dari Negara Ini",CNBC Indonesia,https://www.cnbcindonesia.com/news/20251020160513-4-677582/manufaktur-ri-memang-tumbuh-tapi-menperin-akui-kalah-dari-negara-ini
"Belajar dari Soeharto, Setahun Prabowo Berhasil Swasembada Beras",CNBC Indonesia,https://www.cnbcindonesia.com/entrepreneur/20251020095032-25-677376/belajar-dari-soeharto-setahun-prabowo-berhasil-swasembada-beras
Awas! Amran Akan Cabut Izin Usaha Pedagang yang Jual Beras di Atas HET,CNBC Indonesia,https://www.cnbcindonesia.com/news/20251020182048-4-677643/awas-amran-akan-cabut-izin-usaha-pedagang-yang-jual-beras-di-atas-het
Detik-Detik Sultan Brunei Hassanal Bolkiah Terjatuh di Atas Panggung,CNBC Indonesia,https://www.cnbcindonesia.com/news/20251020150248-7-677543/detik-detik-sultan-brunei-hassanal-bolkiah-terjatuh-di-atas-panggung
"Israel Langgar Gencatan Senjata Gaza, Trump Beri Respons Tak Terduga",CNBC Indonesia,https://www.cnbcindonesia.com/news/20251020131726-4-677472/israel-langgar-gencatan-senjata-gaza-trump-beri-respons-tak-terduga
Gunung Berapi Bangkit usai Tertidur Selama 700.000 Tahun,CNBC Indonesia,https://www.cnbcindonesia.com/lifestyle/20251020093411-33-677357/gunung-berapi-bangkit-usai-tertidur-selama-700000-tahun
"Tiba-tiba Muncul Gunung Baru di Jawa, Ahli Geologi Beri Penjelasan",CNBC Indonesia,https://www.cnbcindonesia.com/tech/20251020130121-37-677460/tiba-tiba-muncul-gunung-baru-di-jawa-ahli-geologi-beri-penjelasan
"Potret Pesawat Emirates Boeing 747 Jatuh ke Laut, Hidung & Ekor Pisah",CNBC Indonesia,https://www.cnbcindonesia.com/news/20251020084710-7-677329/potret-pesawat-emirates-boeing-747-jatuh-ke-laut-hidung-ekor-pisah
"Warga RI Buruan Aktifkan Akun, Biar Bisa Lapor SPT 2025 di Coretax",CNBC Indonesia,https://www.cnbcindonesia.com/news/20251020181324-4-677651/warga-ri-buruan-aktifkan-akun-biar-bisa-lapor-spt-2025-di-coretax
"Setahun Prabowo-Gibran, Kawasan Industri Baru RI Tambah 9",CNBC Indonesia,https://www.cnbcindonesia.com/news/20251020181359-4-677641/setahun-prabowo-gibran-kawasan-industri-baru-ri-tambah-9
"Air Hujan Jakarta Mengandung Mikroplastik, Ahli Jelaskan Penyebabnya",CNBC Indonesia,https://www.cnbcindonesia.com/lifestyle/20251020160238-33-677581/air-hujan-jakarta-mengandung-mikroplastik-ahli-jelaskan-penyebabnya
"TNI Siap Kirim 20.000 Personel ke Gaza, Prabowo: Kita Tak Boleh Lugu",CNBC Indonesia,https://www.cnbcindonesia.com/news/20251020175407-4-677634/tni-siap-kirim-20000-personel-ke-gaza-prabowo-kita-tak-boleh-lugu
"Nomor XL Hangus Bisa Aktif Lagi, Caranya Mudah",CNBC Indonesia,https://www.cnbcindonesia.com/tech/20251020153018-37-677562/nomor-xl-hangus-bisa-aktif-lagi-caranya-mudah
"Manufaktur RI Memang Tumbuh, Tapi Menperin Akui Kalah dari Negara Ini",CNBC Indonesia,https://www.cnbcindonesia.com/news/20251020160513-4-677582/manufaktur-ri-memang-tumbuh-tapi-menperin-akui-kalah-dari-negara-ini
"Belajar dari Soeharto, Setahun Prabowo Berhasil Swasembada Beras",CNBC Indonesia,https://www.cnbcindonesia.com/entrepreneur/20251020095032-25-677376/belajar-dari-soeharto-setahun-prabowo-berhasil-swasembada-beras
Awas! Amran Akan Cabut Izin Usaha Pedagang yang Jual Beras di Atas HET,CNBC Indonesia,https://www.cnbcindonesia.com/news/20251020182048-4-677643/awas-amran-akan-cabut-izin-usaha-pedagang-yang-jual-beras-di-atas-het
"Mencuat di Era Prabowo: Ini 10 Negara yang Jadi ""Bestie"" Baru RI",CNBC Indonesia,https://www.cnbcindonesia.com/research/20251017111926-128-676728/mencuat-di-era-prabowo-ini-10-negara-yang-jadi-bestie-baru-ri
1 Tahun Prabowo-Gibran dan Urgensi Pembangunan dengan Pengawasan,CNBC Indonesia,https://www.cnbcindonesia.com/opini/20251020180508-14-677639/1-tahun-prabowo-gibran-dan-urgensi-pembangunan-dengan-pengawasan
Detik-Detik Sultan Brunei Hassanal Bolkiah Terjatuh di Atas Panggung,CNBC Indonesia,https://www.cnbcindonesia.com/news/20251020150248-7-677543/detik-detik-sultan-brunei-hassanal-bolkiah-terjatuh-di-atas-panggung
"Israel Langgar Gencatan Senjata Gaza, Trump Beri Respons Tak Terduga",CNBC Indonesia,https://www.cnbcindonesia.com/news/20251020131726-4-677472/israel-langgar-gencatan-senjata-gaza-trump-beri-respons-tak-terduga
Gunung Berapi Bangkit usai Tertidur Selama 700.000 Tahun,CNBC Indonesia,https://www.cnbcindonesia.com/lifestyle/20251020093411-33-677357/gunung-berapi-bangkit-usai-tertidur-selama-700000-tahun
"Tiba-tiba Muncul Gunung Baru di Jawa, Ahli Geologi Beri Penjelasan",CNBC Indonesia,https://www.cnbcindonesia.com/tech/20251020130121-37-677460/tiba-tiba-muncul-gunung-baru-di-jawa-ahli-geologi-beri-penjelasan
"Potret Pesawat Emirates Boeing 747 Jatuh ke Laut, Hidung & Ekor Pisah",CNBC Indonesia,https://www.cnbcindonesia.com/news/20251020084710-7-677329/potret-pesawat-emirates-boeing-747-jatuh-ke-laut-hidung-ekor-pisah
"1 Tahun Pemerintahan Prabowo, KPK Ungkit OTT Noel dan Dorong Reformasi Sistem",Detik.com,https://news.detik.com/berita/d-8170243/1-tahun-pemerintahan-prabowo-kpk-ungkit-ott-noel-dan-dorong-reformasi-sistem
"Video: Massa Aksi Bubar, Lalin Jalan Merdeka Selatan Kembali Normal",Detik.com,https://20.detik.com/detikupdate/20251020-251020125/video-massa-aksi-bubar-lalin-jalan-merdeka-selatan-kembali-normal
"Produk Tak Sesuai Klaim, Toko Roti Online Dilaporkan ke Polda Metro Jaya",Detik.com,https://news.detik.com/berita/d-8170232/produk-tak-sesuai-klaim-toko-roti-online-dilaporkan-ke-polda-metro-jaya
Bamsoet Puji 1 Tahun Pemerintahan Prabowo: Tegas dan Responsif,Detik.com,https://news.detik.com/berita/d-8170231/bamsoet-puji-1-tahun-pemerintahan-prabowo-tegas-dan-responsif
Kemensos Gelar Pelatihan Genjot Kualitas Perawatan Lansia-Disabilitas,Detik.com,https://news.detik.com/berita/d-8170230/kemensos-gelar-pelatihan-genjot-kualitas-perawatan-lansia-disabilitas
"Pemprov Sulsel Catat Penghematan Rp 1,4 T dari Optimalisasi Belanja",Detik.com,https://news.detik.com/berita/d-8170199/pemprov-sulsel-catat-penghematan-rp-1-4-t-dari-optimalisasi-belanja
Mahasiswa Unud Pem-bully Korban Bunuh Diri Terancam Di-DO,Detik.com,https://news.detik.com/berita/d-8170207/mahasiswa-unud-pem-bully-korban-bunuh-diri-terancam-di-do
Gangguan KRL Rute Tanah Abang-Rangkasbitung Bikin Perjalanan Telat 28 Menit,Detik.com,https://news.detik.com/berita/d-8170200/gangguan-krl-rute-tanah-abang-rangkasbitung-bikin-perjalanan-telat-28-menit
Unud Tepis Kabar Mahasiswa yang Bunuh Diri karena Tekanan Skripsi,Detik.com,https://news.detik.com/berita/d-8170193/unud-tepis-kabar-mahasiswa-yang-bunuh-diri-karena-tekanan-skripsi
DPP AMPI Adukan 30 Akun Medsos Diduga Hina Bahlil ke Bareskrim,Detik.com,https://news.detik.com/berita/d-8170188/dpp-ampi-adukan-30-akun-medsos-diduga-hina-bahlil-ke-bareskrim
Bisa-bisanya Trump Tuding Presiden Kolombia Gembong Narkoba,Detik.com,https://news.detik.com/internasional/d-8170187/bisa-bisanya-trump-tuding-presiden-kolombia-gembong-narkoba
"Kakorlantas Tekankan Polantas Humanis, Ajak Masyarakat Makin Tertib di Jalan Raya",Detik.com,https://news.detik.com/berita/d-8170186/kakorlantas-tekankan-polantas-humanis-ajak-masyarakat-makin-tertib-di-jalan-raya
"Kakek Asal Surabaya Linglung Nyasar di Bekasi, Polisi Bantu Hubungi Keluarga",Detik.com,https://news.detik.com/berita/d-8170185/kakek-asal-surabaya-linglung-nyasar-di-bekasi-polisi-bantu-hubungi-keluarga
"Launching MYP, Gubernur Sulsel Alokasikan Rp 3,7 T buat 3 Proyek Besar",Detik.com,https://news.detik.com/berita/d-8170184/launching-myp-gubernur-sulsel-alokasikan-rp-3-7-t-buat-3-proyek-besar
Polisi-Dishub Tertibkan Truk Tambang Langgar Jam Operasional di Serang,Detik.com,https://news.detik.com/berita/d-8170175/polisi-dishub-tertibkan-truk-tambang-langgar-jam-operasional-di-serang
KPK Sita Mobil Seharga Rp 1 M dari Rekan Wanita Tersangka CSR BI Heri Gunawan,Detik.com,https://news.detik.com/berita/d-8170170/kpk-sita-mobil-seharga-rp-1-m-dari-rekan-wanita-tersangka-csr-bi-heri-gunawan
"Dorong Pertumbuhan Ekonomi, Kemendagri Awasi Realisasi APBD di Daerah",Detik.com,https://news.detik.com/berita/d-8170154/dorong-pertumbuhan-ekonomi-kemendagri-awasi-realisasi-apbd-di-daerah
SIGAP dan DSS Kehutanan: Menguatkan One Map Policy di Era Digitalisasi,Detik.com,https://news.detik.com/berita/d-8170152/sigap-dan-dss-kehutanan-menguatkan-one-map-policy-di-era-digitalisasi
"Kakorlantas Target 500-1.000 E-TLE Terpasang di Jatim di 2026, Gencarkan Digitalisasi",Detik.com,https://news.detik.com/berita/d-8170143/kakorlantas-target-500-1-000-e-tle-terpasang-di-jatim-di-2026-gencarkan-digitalisasi
"Video: Pesawat Kargo Jatuh ke Laut di Hong Kong, 2 Orang Tewas",Detik.com,https://20.detik.com/detikupdate/20251020-251020117/video-pesawat-kargo-jatuh-ke-laut-di-hong-kong-2-orang-tewas
"1 Tahun Prabowo-Gibran, Mensos Mantapkan Arah dan Strategi Program Sosial",Detik.com,https://news.detik.com/berita/d-8170096/1-tahun-prabowo-gibran-mensos-mantapkan-arah-dan-strategi-program-sosial
"Gempa M 5,7 Guncang Melonguane Sulut",Detik.com,https://news.detik.com/berita/d-8170095/gempa-m-5-7-guncang-melonguane-sulut
"Terkendala Biaya Berobat, Wanita ODGJ di Tenjo Bogor Dipasung di Kandang",Detik.com,https://news.detik.com/berita/d-8170094/terkendala-biaya-berobat-wanita-odgj-di-tenjo-bogor-dipasung-di-kandang
"Demo Mahasiswa di Patung Kuda Jakpus Bubar, Lalin Kembali Normal",Detik.com,https://news.detik.com/berita/d-8170091/demo-mahasiswa-di-patung-kuda-jakpus-bubar-lalin-kembali-normal
Jumlah Perjalanan KRL Rute Rangkasbitung-Tanah Abang Bakal Bertambah,Detik.com,https://news.detik.com/berita/d-8170088/jumlah-perjalanan-krl-rute-rangkasbitung-tanah-abang-bakal-bertambah
"Kemlu Ungkap WNI Korban TPPO Online Scam Rata-rata Gen Z, Ada Lulusan S2",Detik.com,https://news.detik.com/berita/d-8170084/kemlu-ungkap-wni-korban-tppo-online-scam-rata-rata-gen-z-ada-lulusan-s2
Dunia Hari Ini: Ribuan Unjuk Rasa di Amerika Serikat Menentang Donald Trump,Detik.com,https://news.detik.com/abc-australia/d-8170062/dunia-hari-ini-ribuan-unjuk-rasa-di-amerika-serikat-menentang-donald-trump
Polresta Pekanbaru Sinergi dengan TNI-Linmas Jamin Keamanan Investor,Detik.com,https://news.detik.com/melindungi-tuah-marwah/d-8170061/polresta-pekanbaru-sinergi-dengan-tni-linmas-jamin-keamanan-investor
Video: Puluhan Pelajar Peserta Rekor MURI di Purwakarta Keracunan Makanan,Detik.com,https://20.detik.com/detikupdate/20251020-251020111/video-puluhan-pelajar-peserta-rekor-muri-di-purwakarta-keracunan-makanan
"Kemenimipas Gencar Razia Lapas-Rutan, Setahun Sita 10.572 HP-21.843 Elektronik",Detik.com,https://news.detik.com/berita/d-8170048/kemenimipas-gencar-razia-lapas-rutan-setahun-sita-10-572-hp-21-843-elektronik
Video: Prabowo Minta Kepala BGN Sediakan Sendok untuk MBG,Detik.com,https://20.detik.com/detikupdate/20251020-251020115/video-prabowo-minta-kepala-bgn-sediakan-sendok-untuk-mbg
Prabowo Pimpin Sidang Kabinet di Setahun Pemerintahan,Detik.com,https://news.detik.com/foto-news/d-8170038/prabowo-pimpin-sidang-kabinet-di-setahun-pemerintahan
Australia Kecam Jet Tempur China Jatuhkan Suar Dekat Pesawatnya,Detik.com,https://news.detik.com/internasional/d-8170036/australia-kecam-jet-tempur-china-jatuhkan-suar-dekat-pesawatnya
Video: 8 Tuntutan Mahasiswa saat Aksi Demo 1 Tahun Prabowo-Gibran,Detik.com,https://20.detik.com/detikupdate/20251020-251020113/video-8-tuntutan-mahasiswa-saat-aksi-demo-1-tahun-prabowo-gibran
Transjakarta soal Pernyataan Komisaris Ainul Yakin: Itu Pandangan Pribadi,Detik.com,https://news.detik.com/berita/d-8170005/transjakarta-soal-pernyataan-komisaris-ainul-yakin-itu-pandangan-pribadi
Video: Alasan Lisa Mariana Minta Tunda Pemeriksaan Sebagai Tersangka,Detik.com,https://20.detik.com/detikupdate/20251020-251020110/video-alasan-lisa-mariana-minta-tunda-pemeriksaan-sebagai-tersangka-
Polda: Apel Jaga Jakarta Wujud Sinergi Polri-Ojol Dukung Program Pemerintah,Detik.com,https://news.detik.com/berita/d-8170001/polda-apel-jaga-jakarta-wujud-sinergi-polri-ojol-dukung-program-pemerintah
"Busa Putih Tebal Selimuti Sungai di Surabaya, Diduga Akibat Limbah",Detik.com,https://news.detik.com/foto-news/d-8169203/busa-putih-tebal-selimuti-sungai-di-surabaya-diduga-akibat-limbah
Mentrans Sebut Ide Open House 24 Jam Kementrans Terinspirasi dari TEP,Detik.com,https://news.detik.com/berita/d-8170000/mentrans-sebut-ide-open-house-24-jam-kementrans-terinspirasi-dari-tep
Personel Brimob Polda Metro Sabet 2 Medali di Kejuaraan Karate Internasional,Detik.com,https://news.detik.com/berita/d-8169999/personel-brimob-polda-metro-sabet-2-medali-di-kejuaraan-karate-internasional
"Video: Miris, Bocah di Mesuji Dirantai Ortu gegara Terlalu Aktif",Detik.com,https://20.detik.com/detikupdate/20251020-251020109/video-miris-bocah-di-mesuji-dirantai-ortu-gegara-terlalu-aktif
Israel Klaim Pulihkan Gencatan Senjata Usai Serang Gaza,Detik.com,https://news.detik.com/dw/d-8169995/israel-klaim-pulihkan-gencatan-senjata-usai-serang-gaza
"KRL Tanah Abang-Rangkasbitung Gangguan di Jam Pulang Kerja, Anker Teriak!",Detik.com,https://news.detik.com/berita/d-8169994/krl-tanah-abang-rangkasbitung-gangguan-di-jam-pulang-kerja-anker-teriak
Delpedro dan Polda Metro Bacakan Replik-Duplik Praperadilan Kasus Penghasutan,Detik.com,https://news.detik.com/berita/d-8169986/delpedro-dan-polda-metro-bacakan-replik-duplik-praperadilan-kasus-penghasutan
Pemkab Pandeglang Bakal Panggil Kades di Munjul yang Viral Diduga Mesum,Detik.com,https://news.detik.com/berita/d-8169983/pemkab-pandeglang-bakal-panggil-kades-di-munjul-yang-viral-diduga-mesum
"1 Tahun Prabowo-Gibran, Pupuk Indonesia Perkuat Program Swasembada Pangan",Detik.com,https://news.detik.com/berita/d-8169979/1-tahun-prabowo-gibran-pupuk-indonesia-perkuat-program-swasembada-pangan
Kemendagri Raih Predikat 'Sangat Memuaskan' dalam Pengawasan Kearsipan,Detik.com,https://news.detik.com/berita/d-8169978/kemendagri-raih-predikat-sangat-memuaskan-dalam-pengawasan-kearsipan
Trump Usulkan Pembagian Donbas untuk Akhiri Invasi Rusia di Ukraina,Detik.com,https://news.detik.com/dw/d-8169970/trump-usulkan-pembagian-donbas-untuk-akhiri-invasi-rusia-di-ukraina
"Cerita Prabowo Saat Naik Alphard: Ingat Kamu Presiden, Pakai Maung",Detik.com,https://news.detik.com/berita/d-8169968/cerita-prabowo-saat-naik-alphard-ingat-kamu-presiden-pakai-maung
Warga di Depok Amankan Pemuda Bawa Golok-Parang untuk Serang Teman,Detik.com,https://news.detik.com/berita/d-8169960/warga-di-depok-amankan-pemuda-bawa-golok-parang-untuk-serang-teman
5 Berita Terpopuler Internasional Hari Ini,Detik.com,https://news.detik.com/internasional/d-8169958/5-berita-terpopuler-internasional-hari-ini
Ahmad Luthfi Sebut Kebijakan Trump Bawa Dampak Positif ke Ekonomi Jateng,Detik.com,https://news.detik.com/bangun-indonesia/d-8169955/ahmad-luthfi-sebut-kebijakan-trump-bawa-dampak-positif-ke-ekonomi-jateng
Penculikan Modus Jual Beli Mobil di Tangsel Libatkan Pecatan TNI AL,Detik.com,https://news.detik.com/berita/d-8169954/penculikan-modus-jual-beli-mobil-di-tangsel-libatkan-pecatan-tni-al
Prabowo Targetkan 3 Tahun Lagi Indonesia Punya Mobil Buatan Sendiri,Detik.com,https://news.detik.com/berita/d-8169935/prabowo-targetkan-3-tahun-lagi-indonesia-punya-mobil-buatan-sendiri
AS Bilang Israel Harus Bantu Palestina Usai Perang Gaza,Detik.com,https://news.detik.com/internasional/d-8169929/as-bilang-israel-harus-bantu-palestina-usai-perang-gaza
Kapolda Banten Luncurkan Pamapta-Tim Negosiator untuk Pelayanan Humanis,Detik.com,https://news.detik.com/berita/d-8169925/kapolda-banten-luncurkan-pamapta-tim-negosiator-untuk-pelayanan-humanis
